{
  "schema_version": 1,
  "id": "terminal-completion-rate-v1",
  "kind": "deterministic",
  "direction": "higher-is-better",
  "unit": "ratio",
  "aggregation": "mean",
  "hard_gate": true,
  "required_slices": [
    "terminal-pty"
  ],
  "uncertainty": "none",
  "source": {
    "oracle_id": "terminal-completed-v1"
  }
}
