{
  "schema_version": 1,
  "id": "command-exit-one-observed-v1",
  "kind": "deterministic",
  "direction": "higher-is-better",
  "unit": "ratio",
  "aggregation": "mean",
  "hard_gate": true,
  "required_slices": ["command-failure"],
  "uncertainty": "none",
  "source": { "oracle_id": "command-exit-one-v1" }
}
