{
  "schema_version": 1,
  "id": "mobile-completion-rate-v1",
  "kind": "deterministic",
  "direction": "higher-is-better",
  "unit": "ratio",
  "aggregation": "mean",
  "hard_gate": true,
  "required_slices": ["mobile-provider"],
  "uncertainty": "none",
  "source": { "oracle_id": "mobile-completed-v1" }
}
